{
  "contractVersion": "2026-07-30",
  "requestId": "req_fixture_complete",
  "staticDatasetVersion": "gtfs_fixture_v1",
  "realtimeSnapshotId": "rt_fixture_v1",
  "dataMode": "synthetic",
  "freshness": {
    "realtimeAgeSeconds": 0,
    "staticActivatedAt": "2026-07-29T06:00:00.000Z",
    "warnings": []
  },
  "baseline": {
    "itineraries": [
      {
        "itineraryId": "itin_base_1",
        "fingerprint": "fp_base_f_only",
        "durationSeconds": 1680,
        "arrivalTime": "2026-07-30T14:28:00.000Z",
        "walkingSeconds": 240,
        "waitingSeconds": 180,
        "transferCount": 0,
        "lineSequence": ["F"],
        "legs": [
          {
            "legId": "leg_w1",
            "kind": "walk",
            "durationSeconds": 180,
            "distanceMeters": 220,
            "outOfSystem": true,
            "instruction": "Walk to Carroll St"
          },
          {
            "legId": "leg_t1",
            "kind": "transit",
            "lineId": "F",
            "tripId": "trip_f_1",
            "headsign": "Jamaica-179 St",
            "from": { "name": "Carroll St", "stationId": "st_carroll" },
            "to": { "name": "42 St-Bryant Park", "stationId": "st_bryant" },
            "departTime": "2026-07-30T14:03:00.000Z",
            "arriveTime": "2026-07-30T14:26:00.000Z",
            "durationSeconds": 1380,
            "sourceEngineIds": { "engine": "fixture" }
          },
          {
            "legId": "leg_w2",
            "kind": "walk",
            "durationSeconds": 60,
            "outOfSystem": true
          }
        ],
        "satisfaction": {
          "requestedLineIds": [],
          "satisfiedLineIds": [],
          "omittedLineIds": [],
          "satisfactionCount": 0,
          "requestedCount": 0,
          "isComplete": true,
          "feasibility": "not_applicable"
        },
        "realtimeConfidence": "none",
        "alerts": [],
        "explanation": {
          "summary": "Baseline F train ride with short walks.",
          "facts": [
            { "type": "walk", "message": "Includes 4 minutes of walking.", "seconds": 240 }
          ],
          "baselineDeltaSeconds": null
        },
        "reliability": null,
        "candidateFamily": "baseline"
      }
    ]
  },
  "constrained": {
    "itineraries": [
      {
        "itineraryId": "itin_c_1",
        "fingerprint": "fp_f_b_complete",
        "durationSeconds": 1920,
        "arrivalTime": "2026-07-30T14:32:00.000Z",
        "walkingSeconds": 300,
        "waitingSeconds": 240,
        "transferCount": 1,
        "lineSequence": ["F", "B"],
        "legs": [
          {
            "legId": "leg_cw1",
            "kind": "walk",
            "durationSeconds": 180,
            "outOfSystem": true
          },
          {
            "legId": "leg_cf",
            "kind": "transit",
            "lineId": "F",
            "tripId": "trip_f_2",
            "from": { "name": "Carroll St", "stationId": "st_carroll" },
            "to": { "name": "West 4 St", "stationId": "st_w4" },
            "departTime": "2026-07-30T14:03:00.000Z",
            "arriveTime": "2026-07-30T14:12:00.000Z",
            "durationSeconds": 540
          },
          {
            "legId": "leg_ct",
            "kind": "walk",
            "durationSeconds": 120,
            "outOfSystem": false,
            "instruction": "Transfer within complex"
          },
          {
            "legId": "leg_cb",
            "kind": "transit",
            "lineId": "B",
            "tripId": "trip_b_1",
            "from": { "name": "West 4 St", "stationId": "st_w4" },
            "to": { "name": "42 St-Bryant Park", "stationId": "st_bryant" },
            "departTime": "2026-07-30T14:16:00.000Z",
            "arriveTime": "2026-07-30T14:30:00.000Z",
            "durationSeconds": 840
          },
          {
            "legId": "leg_cw2",
            "kind": "walk",
            "durationSeconds": 120,
            "outOfSystem": true
          }
        ],
        "satisfaction": {
          "requestedLineIds": ["F", "B"],
          "satisfiedLineIds": ["F", "B"],
          "omittedLineIds": [],
          "satisfactionCount": 2,
          "requestedCount": 2,
          "isComplete": true,
          "feasibility": "complete"
        },
        "realtimeConfidence": "medium",
        "alerts": [],
        "explanation": {
          "summary": "Uses both selected lines F and B with one transfer.",
          "facts": [
            { "type": "line_used", "message": "Uses the F train.", "lineId": "F" },
            { "type": "line_used", "message": "Uses the B train.", "lineId": "B" },
            { "type": "transfer", "message": "One transfer at West 4 St." },
            {
              "type": "baseline_delta",
              "message": "Arrives 4 minutes later than the baseline.",
              "seconds": 240
            }
          ],
          "baselineDeltaSeconds": 240
        },
        "reliability": null,
        "candidateFamily": "constrained"
      }
    ],
    "satisfactionSummary": {
      "bestSatisfactionCount": 2,
      "requestedCount": 2,
      "completeMatchFound": true
    }
  },
  "experiment": {
    "explanationVariant": "concise"
  }
}
